{
  "$schema": "https://json-schema.org/draft/2020-12/schema",
  "$id": "https://syc.local/linkdigest/capture-envelope-v1.schema.json",
  "title": "LinkDigest V0.1 Capture Contract",
  "description": "Language-neutral Native Messaging contract. Objects accept unknown optional fields for forward compatibility; required fields and semantic invariants remain enforced by both runtimes.",
  "type": "object",
  "required": ["version", "requestId", "createdAt", "source", "capture", "evidence"],
  "additionalProperties": true,
  "properties": {
    "version": {"const": 1},
    "requestId": {"type": "string", "minLength": 1, "maxLength": 128},
    "createdAt": {"type": "string", "format": "date-time"},
    "idempotencyKey": {"type": "string", "minLength": 1, "maxLength": 256},
    "source": {
      "type": "object", "required": ["kind", "url", "title", "platform"], "additionalProperties": true,
      "properties": {
        "kind": {"const": "browser_capture"},
        "url": {"type": "string", "format": "uri", "maxLength": 8192, "pattern": "^https?://"},
        "title": {"type": ["string", "null"], "maxLength": 1024},
        "platform": {"type": "string", "enum": ["generic", "x", "youtube", "wechat", "xiaohongshu", "douyin", "bilibili"]}
      }
    },
    "capture": {
      "type": "object", "required": ["method", "text", "characterCount", "completeness", "capturedAt"], "additionalProperties": true,
      "properties": {
        "method": {"type": "string", "enum": ["rendered_dom", "selection"]},
        "text": {"type": "string", "minLength": 1, "maxLength": 2000000},
        "characterCount": {"type": "integer", "minimum": 1, "maximum": 2000000},
        "completeness": {"type": "string", "enum": ["full_article", "visible_only", "selection_only", "unknown"]},
        "capturedAt": {"type": "string", "format": "date-time"}
      }
    },
    "evidence": {
      "type": "object", "required": ["sourceLabel", "usedCookie"], "additionalProperties": true,
      "properties": {"sourceLabel": {"type": "string", "minLength": 1, "maxLength": 128}, "usedCookie": {"const": false}}
    }
  },
  "$defs": {
    "AppError": {
      "type": "object", "required": ["version", "requestId", "createdAt", "category", "code", "retryable", "action"], "additionalProperties": true,
      "properties": {
        "version": {"const": 1}, "requestId": {"type": "string", "minLength": 1, "maxLength": 128}, "createdAt": {"type": "string", "format": "date-time"},
        "category": {"type": "string", "enum": ["protocol", "permission", "network", "extraction", "storage", "unknown"]},
        "code": {"type": "string", "pattern": "^[A-Z][A-Z0-9_]{2,63}$"}, "retryable": {"type": "boolean"},
        "action": {"type": "string", "enum": ["retry", "open_app", "open_install_guide", "open_in_browser", "grant_permission", "upgrade_app", "none"]}, "safeDetail": {"type": "string", "maxLength": 2000}
      }
    },
    "NativeResponse": {
      "oneOf": [
        {"type": "object", "required": ["kind", "version", "requestId", "characterCount"], "additionalProperties": true, "properties": {"kind": {"const": "taskAccepted"}, "version": {"const": 1}, "requestId": {"type": "string"}, "characterCount": {"type": "integer"}}},
        {"type": "object", "required": ["kind", "error"], "additionalProperties": true, "properties": {"kind": {"const": "error"}, "error": {"$ref": "#/$defs/AppError"}}}
      ]
    }
  },
  "x-semantic-invariants": [
    "capture.characterCount equals the Unicode code point count of capture.text (Swift scalar count; TypeScript [...text].length)",
    "capture.text and all URL/title fields are never written to ordinary logs",
    "Native Messaging framing limit is 4 MiB bytes; text limit is 2,000,000 Unicode scalars"
  ]
}
