{"version":1,"requestId":"fixture-valid-1","createdAt":"2026-07-13T20:00:00Z","idempotencyKey":"fixture:valid:1","source":{"kind":"browser_capture","url":"https://example.test/article","title":"Fixture Article","platform":"generic"},"capture":{"method":"rendered_dom","text":"Readable content","characterCount":16,"completeness":"full_article","capturedAt":"2026-07-13T20:00:00Z"},"evidence":{"sourceLabel":"Current page DOM","usedCookie":false}}
