{"version":1,"requestId":"fixture-url-1","createdAt":"2026-07-13T20:00:00Z","source":{"kind":"browser_capture","url":"file:///tmp/private.html","title":"Fixture","platform":"generic"},"capture":{"method":"rendered_dom","text":"Readable content","characterCount":16,"completeness":"full_article","capturedAt":"2026-07-13T20:00:00Z"},"evidence":{"sourceLabel":"Current page DOM","usedCookie":false}}
