{"version":1,"requestId":"fixture-unicode-emoji","createdAt":"2026-07-15T04:00:00Z","source":{"kind":"browser_capture","url":"https://example.test/unicode/emoji","title":"Unicode emoji","platform":"generic"},"capture":{"method":"rendered_dom","text":"😀","characterCount":1,"completeness":"full_article","capturedAt":"2026-07-15T04:00:00Z"},"evidence":{"sourceLabel":"Unicode fixture","usedCookie":false}}
