{"version":1,"requestId":"fixture-unicode-nul","createdAt":"2026-07-15T04:00:00Z","source":{"kind":"browser_capture","url":"https://example.test/unicode/nul","title":"Unicode NUL","platform":"generic"},"capture":{"method":"rendered_dom","text":"a\u0000b","characterCount":3,"completeness":"full_article","capturedAt":"2026-07-15T04:00:00Z"},"evidence":{"sourceLabel":"Unicode fixture","usedCookie":false}}
