{"version":1,"requestId":"fixture-unicode-combining","createdAt":"2026-07-15T04:00:00Z","source":{"kind":"browser_capture","url":"https://example.test/unicode/combining","title":"Unicode combining","platform":"generic"},"capture":{"method":"rendered_dom","text":"é","characterCount":2,"completeness":"full_article","capturedAt":"2026-07-15T04:00:00Z"},"evidence":{"sourceLabel":"Unicode fixture","usedCookie":false}}
